{
  "evidence_version": "0.1",
  "evidence_id": "ev-2026-05-12-a4f9c1",
  "claim_text": "The AEO Protocol defines three pillars: Declare, Discover, and Audit.",
  "source": {
    "uri": "https://github.com/mizcausevic-dev/aeo-protocol-spec/blob/main/SPEC.md",
    "type": "document",
    "title": "AEO Protocol v0.1 — Specification",
    "publisher": "mizcausevic-dev",
    "fetched_at": "2026-05-12T03:45:00Z"
  },
  "span": {
    "selector_type": "text_quote",
    "selector_value": "## 3. The three pillars",
    "exact_text": "## 3. The three pillars\n\n### 3.1 Declare\n\nThe entity publishes a single JSON document at a fixed path describing itself.",
    "surrounding_context": "Section §3 of the specification document."
  },
  "retrieval": {
    "method": "hybrid",
    "confidence": 0.93,
    "rank": 1,
    "freshness_age_seconds": 90,
    "retriever_id": "kinetic-rag-v3"
  },
  "verification": {
    "content_hash": "sha256:e43d95c8dc378e3658dc8beb53755dd2d66987034a9cbf989030906f5de258fa",
    "signed_by": "kinetic-rag-pipeline"
  },
  "synthesis_role": "supporting"
}
